,start,start_ms,end,end_ms,file,volume,text
659,00:25:32.697,1532697,00:25:34.148,1534148,chunk660.wav,13698,also arguing that it's just going to force more people to turn to the black market.
660,00:25:35.600,1535600,00:25:36.467,1536467,chunk661.wav,12085,"of course, with this conversation, there's a question of,"
661,00:25:37.335,1537335,00:25:38.686,1538686,chunk662.wav,10214,"okay, well, if you make this a law, what happens then?"
662,00:25:40.038,1540038,00:25:40.538,1540538,chunk663.wav,13349,well there we see
663,00:25:41.039,1541039,00:25:42.023,1542023,chunk664.wav,12227,and one way that it plays out because this all might sound
664,00:25:43.008,1543008,00:25:44.159,1544159,chunk665.wav,12369,kind of familiar that's because New Zealand actually passed
665,00:25:45.310,1545310,00:25:47.061,1547061,chunk666.wav,13225,a strict generational ban on cigaret sales when Jacinda Ardern was prime minister.
666,00:25:48.947,1548947,00:25:50.165,1550165,chunk667.wav,13007,them even partially modeling it after Brooklyn's efforts.
667,00:25:51.383,1551383,00:25:53.268,1553268,chunk668.wav,14750,"but notably there in November of 2023, before it had fully come to fruition,"
668,00:25:55.153,1555153,00:25:56.087,1556087,chunk669.wav,10953,the new conservative government gave it the boot.
669,00:25:57.022,1557022,00:25:57.789,1557789,chunk670.wav,13416,with them not really giving too many details
670,00:25:58.557,1558557,00:25:59.357,1559357,chunk671.wav,11998,"as to why they were doing away with it, though"
671,00:26:00.158,1560158,00:26:01.409,1561409,chunk672.wav,11695,"you did have their finance minister, Nicola Willis, saying."
672,00:26:02.661,1562661,00:26:03.795,1563795,chunk673.wav,13370,"still want to see lower numbers of people smoking,"
673,00:26:04.930,1564930,00:26:05.897,1565897,chunk674.wav,12428,but we do not think that the outgoing government's
674,00:26:06.865,1566865,00:26:07.749,1567749,chunk675.wav,14157,policy is the best way to achieve that.
675,00:26:08.633,1568633,00:26:10.034,1570034,chunk676.wav,13186,"that, notably, isn't the only place where a concept like this has fizzled out."
676,00:26:11.436,1571436,00:26:12.253,1572253,chunk677.wav,12567,"Last year, for example, a member of California State"
677,00:26:13.071,1573071,00:26:14.272,1574272,chunk678.wav,10588,Assembly tried to bring forward a plan to phase out tobacco sales.
678,00:26:15.473,1575473,00:26:17.058,1577058,chunk679.wav,13110,"but per calmatters, it was quickly shelved after not getting enough traction."
679,00:26:18.643,1578643,00:26:19.811,1579811,chunk680.wav,13116,"so while yes, this does seem to be a growing trend,"
680,00:26:20.979,1580979,00:26:21.880,1581880,chunk681.wav,12871,it is pretty rocky right now. and so obviously.
681,00:26:22.781,1582781,00:26:23.848,1583848,chunk682.wav,11974,"Well, we'll have to wait to see how this plays out."
682,00:26:24.916,1584916,00:26:25.416,1585416,chunk683.wav,13322,"I got to ask you,"
683,00:26:25.917,1585917,00:26:26.317,1586317,chunk684.wav,12457,what are your thoughts
684,00:26:26.718,1586718,00:26:28.703,1588703,chunk685.wav,12119,"about not only the situation, but the idea in general of a generational ban?"
685,00:26:30.689,1590689,00:26:31.523,1591523,chunk686.wav,13217,you for it or are you against it? Why?
686,00:26:32.357,1592357,00:26:33.575,1593575,chunk687.wav,25677,"Why not? that, my friends, is the end of your Tuesday evening."
687,00:26:34.793,1594793,00:26:35.543,1595543,chunk688.wav,12122,Wednesday morning dive into the news.
688,00:26:36.294,1596294,00:26:37.312,1597312,chunk689.wav,14476,you for being a part of another daily clubhouse meeting.
689,00:26:38.330,1598330,00:26:39.614,1599614,chunk690.wav,14265,love your faces. And I'll see you right back here tomorrow.
