,start,start_ms,end,end_ms,file,volume,text
231,00:08:31.177,511177,00:08:31.794,511794,chunk232.wav,13367,And you had Musk claiming at the event
232,00:08:32.411,512411,00:08:33.712,513712,chunk233.wav,13507,was under a massive dose or denial of service attack.
233,00:08:35.014,515014,00:08:35.815,515815,chunk234.wav,14646,which is basically when someone floods a website
234,00:08:36.616,516616,00:08:37.850,517850,chunk235.wav,12793,with traffic in order to overwhelm it and knock it offline.
235,00:08:39.085,519085,00:08:39.201,519201,chunk236.wav,12678,I will.
236,00:08:39.318,519318,00:08:40.936,520936,chunk237.wav,14758,"Say as of recording, it is still not clear that this was an actual attack at all."
237,00:08:42.555,522555,00:08:43.522,523522,chunk238.wav,14640,"I mean, the site has had issues in the past,"
238,00:08:44.490,524490,00:08:45.908,525908,chunk239.wav,13121,and that's not counting when they did that live stream event for Ron DeSantis.
239,00:08:47.326,527326,00:08:47.476,527476,chunk240.wav,7827,then with.
240,00:08:47.627,527627,00:08:48.244,528244,chunk241.wav,13049,"All that said, on the other side of this year,"
241,00:08:48.861,528861,00:08:49.929,529929,chunk242.wav,12577,the Harris campaign commenting on everything.
242,00:08:50.997,530997,00:08:52.732,532732,chunk243.wav,14408,"bromance, the technical issues, the actual content of the interview."
243,00:08:54.467,534467,00:08:54.934,534934,chunk244.wav,14483,Writing in a statement.
244,00:08:55.401,535401,00:08:57.369,537369,chunk245.wav,14899,"Donald Trump's Extremism and Dangerous Project 2025 agenda is a feature,"
245,00:08:59.338,539338,00:09:00.055,540055,chunk246.wav,13066,"not a glitch, of his campaign,"
246,00:09:00.773,540773,00:09:01.790,541790,chunk247.wav,12965,which was on full display for those unlucky enough
247,00:09:02.808,542808,00:09:04.126,544126,chunk248.wav,12668,to listen in tonight during whatever that was on X-Com.
248,00:09:05.444,545444,00:09:05.928,545928,chunk249.wav,13571,going on to say Trump's
249,00:09:06.412,546412,00:09:08.280,548280,chunk250.wav,14508,entire campaign is in service of people like Elon Musk and himself.
250,00:09:10.149,550149,00:09:11.417,551417,chunk251.wav,13398,"Self-obsessed rich guys will sell out the middle class,"
251,00:09:12.685,552685,00:09:13.969,553969,chunk252.wav,12527,and who cannot run a live stream in the year 2024.
252,00:09:15.254,555254,00:09:15.988,555988,chunk253.wav,14268,"And then as far as, you know, other reactions"
253,00:09:16.722,556722,00:09:17.740,557740,chunk254.wav,13561,"we've seen you have, again, had some people saying"
254,00:09:18.758,558758,00:09:19.642,559642,chunk255.wav,12338,is good to see Trump in this light.
255,00:09:20.526,560526,00:09:21.293,561293,chunk256.wav,12784,"A number of conservatives saying, hey, it's"
256,00:09:22.061,562061,00:09:23.596,563596,chunk257.wav,13053,"good to have something that they can point their moderate friends to of, hey,"
257,00:09:25.131,565131,00:09:26.315,566315,chunk258.wav,14912,this is what Donald Trump is doing when he's not fighting somebody.
258,00:09:27.500,567500,00:09:28.484,568484,chunk259.wav,16023,but then also at the same. Time he had political commentators
259,00:09:29.468,569468,00:09:29.818,569818,chunk260.wav,10723,like a sand picker
260,00:09:30.169,570169,00:09:31.770,571770,chunk261.wav,13980,saying it was actually not in Trump's favor to take such a softball interview.
261,00:09:33.372,573372,00:09:34.690,574690,chunk262.wav,8355,think one thing that people fail to consider
262,00:09:36.008,576008,00:09:37.059,577059,chunk263.wav,9419,is that Trump actually performs really
263,00:09:38.110,578110,00:09:39.628,579628,chunk264.wav,8787,"well in adversarial interviews because he gets, like, bitchy."
264,00:09:41.847,581847,00:09:43.248,583248,chunk265.wav,8840,And when it's a glazed over and I've listened to
265,00:09:44.650,584650,00:09:46.468,586468,chunk266.wav,8868,so many Trump glazed sessions with Sean Hannity where he sucks them
266,00:09:48.588,588588,00:09:50.389,590389,chunk267.wav,9133,screaming like he gives him that good suck because it's very boring.
267,00:09:52.191,592191,00:09:54.293,594293,chunk268.wav,9314,"It comes across as like a very boring, low energy back and forth."
268,00:09:56.562,596562,00:09:57.513,597513,chunk269.wav,14928,"with all that said, the last thing I'll touch on"
269,00:09:58.464,598464,00:10:00.165,600165,chunk270.wav,13782,"is Trump's return to X, mean, since having his account reinstated by Musk"
270,00:10:01.867,601867,00:10:02.668,602668,chunk271.wav,13336,the last time Trump posted on the platform
271,00:10:03.469,603469,00:10:04.937,604937,chunk272.wav,13083,was when he shared his mugshot from the Georgia election subversion case.
272,00:10:06.405,606405,00:10:08.023,608023,chunk273.wav,15068,"but now what we've seen is in the past 24 hours, he's posted several times."
273,00:10:09.642,609642,00:10:10.176,610176,chunk274.wav,14814,"interestingly, his return"
274,00:10:10.710,610710,00:10:12.261,612261,chunk275.wav,14445,to X may be actually devaluing his own social media platform.
275,00:10:13.913,613913,00:10:14.980,614980,chunk276.wav,13661,a seeing the stock of Trump media and technology group
276,00:10:16.048,616048,00:10:17.182,617182,chunk277.wav,14019,which owns truth social dropping after last night
277,00:10:18.317,618317,00:10:19.718,619718,chunk278.wav,12693,"it specifically falling more than 3% when the market opened this morning,"
278,00:10:21.120,621120,00:10:22.571,622571,chunk279.wav,12606,"which is the lowest it's been in months, but also there, I will say"
279,00:10:24.023,624023,00:10:24.807,624807,chunk280.wav,13216,shares have already been trending downwards.
280,00:10:25.591,625591,00:10:26.258,626258,chunk281.wav,14219,"which makes sense because really,"
281,00:10:26.926,626926,00:10:27.993,627993,chunk282.wav,13281,none of the numbers for the company have ever been good.
282,00:10:29.061,629061,00:10:31.013,631013,chunk283.wav,14722,"and just last week, the company reported a $16 million loss for the second quarter."
283,00:10:33.032,633032,00:10:34.099,634099,chunk284.wav,16083,"hey, whether you listen to any or all of the call"
284,00:10:35.167,635167,00:10:36.301,636301,chunk285.wav,14360,"last night, I'd love to know your thoughts here. Y'all."
285,00:10:37.436,637436,00:10:38.887,638887,chunk286.wav,15473,"Do you not hate when you're missin that key ingredient, like,"
286,00:10:40.339,640339,00:10:41.657,641657,chunk287.wav,13820,sirup for your pancakes or favorite coffee creamer?
287,00:10:42.975,642975,00:10:44.476,644476,chunk288.wav,17435,"well, thanks to the fantastic sponsor of today's show, DoorDash."
288,00:10:45.978,645978,00:10:47.212,647212,chunk289.wav,13948,You can get groceries delivered to you right when you need them.
289,00:10:48.447,648447,00:10:50.282,650282,chunk290.wav,14546,"it's not just for when you forget that one item or two, you can get your entire"
290,00:10:52.151,652151,00:10:53.702,653702,chunk291.wav,12770,"grocery shopping list via the DoorDash delivery at, mean, the DoorDash app,"
291,00:10:55.254,655254,00:10:55.904,655904,chunk292.wav,11744,it makes shopping a breeze.
292,00:10:56.555,656555,00:10:58.090,658090,chunk293.wav,13608,"You choose from a wide range of items, from your favorite local stores,"
293,00:10:59.625,659625,00:11:02.061,662061,chunk294.wav,13827,"from fresh produce to pantry staples to gifts to pet essentials, all in one place."
294,00:11:04.563,664563,00:11:06.231,666231,chunk295.wav,14537,"the app allows you to customize, substitute, schedule and track your order,"
295,00:11:07.900,667900,00:11:09.551,669551,chunk296.wav,14523,as well as communicate with your shopper while receiving real time updates.
296,00:11:11.203,671203,00:11:12.771,672771,chunk297.wav,13772,"mean, it really is the all in one solution for all your lifestyle needs."
297,00:11:14.340,674340,00:11:16.075,676075,chunk298.wav,14779,"the next time that you're running low on groceries or really most anything,"
298,00:11:17.810,677810,00:11:19.011,679011,chunk299.wav,12815,you can get them delivered right to your door through DoorDash.
299,00:11:20.212,680212,00:11:21.063,681063,chunk300.wav,12953,"everything you need when you need it,"
300,00:11:21.914,681914,00:11:23.849,683849,chunk301.wav,13804,and use code DeFranco 50 to get 50% off up to a $10 value
301,00:11:25.785,685785,00:11:27.887,687887,chunk302.wav,13718,when you spend $15 or more at convenience grocery or select retail stores.
302,00:11:29.989,689989,00:11:31.056,691056,chunk303.wav,13269,"for me, I mean, it's not like they're just a delivery service."
303,00:11:32.124,692124,00:11:32.541,692541,chunk304.wav,8820,They're your trusted
304,00:11:32.958,692958,00:11:34.459,694459,chunk305.wav,13183,"assistant, helping you navigate the complexities of modern life."
305,00:11:36.095,696095,00:11:36.979,696979,chunk306.wav,15811,we need to talk about how Donald Trump was right.
306,00:11:37.863,697863,00:11:38.797,698797,chunk307.wav,13570,Someone tampered with the voting machines.
307,00:11:39.732,699732,00:11:40.766,700766,chunk308.wav,15275,"like you to meet Tina Peters, the former"
308,00:11:41.801,701801,00:11:43.769,703769,chunk309.wav,13861,"county clerk of Mesa County, Colorado, and a dedicated Trump supporter."
309,00:11:45.738,705738,00:11:46.171,706171,chunk310.wav,15382,An election denier. Right.
310,00:11:46.605,706605,00:11:47.523,707523,chunk311.wav,12957,And she is in the news because she has now been
311,00:11:48.441,708441,00:11:49.442,709442,chunk312.wav,12767,convicted of tampering with voting machines.
312,00:11:50.443,710443,00:11:50.960,710960,chunk313.wav,14173,let me paint the scene for you.
313,00:11:51.477,711477,00:11:52.494,712494,chunk314.wav,14551,"is spring of 2021, in Mesa County."
314,00:11:53.512,713512,00:11:54.646,714646,chunk315.wav,13771,"And like many others, Tina has latched on to the idea"
315,00:11:55.781,715781,00:11:57.399,717399,chunk316.wav,13852,that Dominion voting machines were used to rig the election against Donald Trump.
316,00:11:59.018,719018,00:12:00.002,720002,chunk317.wav,14141,and in April she reportedly hears of an impending
317,00:12:00.986,720986,00:12:02.004,722004,chunk318.wav,12726,update to the machines that's going to delete the data
318,00:12:03.022,723022,00:12:03.689,723689,chunk319.wav,10681,that would supposedly prove this.
319,00:12:04.356,724356,00:12:05.891,725891,chunk320.wav,13952,so she is said to have asked for help and was put into contact with an associate
320,00:12:07.426,727426,00:12:08.427,728427,chunk321.wav,15946,of Mike Lindell. Yes. The MyPillow guy.
321,00:12:09.428,729428,00:12:10.612,730612,chunk322.wav,13764,"and of course, yes, also another prominent election denier."
322,00:12:11.797,731797,00:12:12.397,732397,chunk323.wav,14623,"in May, Tina reportedly allows"
323,00:12:12.998,732998,00:12:14.650,734650,chunk324.wav,12516,"an unauthorized person named Conan Hayes, a server turned tech expert,"
324,00:12:16.368,736368,00:12:16.852,736852,chunk325.wav,13552,to watch the software
325,00:12:17.336,737336,00:12:18.837,738837,chunk326.wav,14729,update and make copies of the hard drive using the security badge of the employee
326,00:12:20.372,740372,00:12:20.689,740689,chunk327.wav,7925,who worked for
327,00:12:21.006,741006,00:12:22.257,742257,chunk328.wav,14248,"and once he's had access to the machine, he reportedly was able to capture"
328,00:12:23.509,743509,00:12:25.227,745227,chunk329.wav,13194,county passwords and sensitive information about Dominion's proprietary software.
329,00:12:26.946,746946,00:12:28.180,748180,chunk330.wav,13645,"which is how within months, that data is said to have shown up online"
330,00:12:29.415,749415,00:12:30.416,750416,chunk331.wav,12788,"and at Mike Lindell Symposium, which was an event"
331,00:12:31.417,751417,00:12:32.318,752318,chunk332.wav,12867,questioning the results of the 2020 election.
332,00:12:33.219,753219,00:12:34.687,754687,chunk333.wav,14265,"with this, Tina was indicted on ten charges back in 2022."
333,00:12:36.155,756155,00:12:37.656,757656,chunk334.wav,14986,"And from that time to now, it's just been riddled with insanity."
334,00:12:39.225,759225,00:12:40.292,760292,chunk335.wav,14496,"one point, she violated the conditions of her bond"
335,00:12:41.360,761360,00:12:42.511,762511,chunk336.wav,12870,and a protective order by sending an email to the Mesa County
336,00:12:43.662,763662,00:12:44.897,764897,chunk337.wav,14405,Clerk's office to request a recount of the secretary of state
337,00:12:46.132,766132,00:12:46.932,766932,chunk338.wav,11612,"primary election, that she lost,"
338,00:12:47.733,767733,00:12:48.650,768650,chunk339.wav,14145,"her trial, the prosecution argued, Tina tricked"
339,00:12:49.568,769568,00:12:50.652,770652,chunk340.wav,13014,election workers and public employees to let an outsider
340,00:12:51.737,771737,00:12:53.105,773105,chunk341.wav,13155,take pictures of the hard drives of the county's election system. Right.
341,00:12:54.473,774473,00:12:55.891,775891,chunk342.wav,14076,In order to paint herself as the hero at Lindell's event. with us.
342,00:12:57.309,777309,00:12:58.310,778310,chunk343.wav,13825,You had a lawyer for the Colorado Attorney General's office
343,00:12:59.311,779311,00:13:00.662,780662,chunk344.wav,15732,saying defendant was a fox guarding the henhouse.
344,00:13:02.014,782014,00:13:03.065,783065,chunk345.wav,14061,"was her job to protect the election equipment,"
345,00:13:04.116,784116,00:13:05.584,785584,chunk346.wav,13709,and she turned on it and used her power for her own advantage.
346,00:13:07.052,787052,00:13:08.503,788503,chunk347.wav,14376,"and as for the defense, they argued that she was trying to maintain records"
347,00:13:09.955,789955,00:13:11.039,791039,chunk348.wav,13575,to help determine if any foreign individuals access
348,00:13:12.124,792124,00:13:13.075,793075,chunk349.wav,13825,the voting system while the results were being counted.
349,00:13:14.026,794026,00:13:14.309,794309,chunk350.wav,15295,"and all along,"
350,00:13:14.593,794593,00:13:15.527,795527,chunk351.wav,12555,"according to the New York Times, a judge in his case"
351,00:13:16.462,796462,00:13:17.730,797730,chunk352.wav,13478,often had to redirect the defense back to Tina's behavior
352,00:13:18.998,798998,00:13:20.065,800065,chunk353.wav,13487,rather than theories about Dominion's voting machines.
353,00:13:21.133,801133,00:13:22.084,802084,chunk354.wav,14966,the defense at one point even requesting to subpoena
354,00:13:23.035,803035,00:13:24.586,804586,chunk355.wav,17052,"the top lawyer from Dominion to testify, which is a request that was denied."
355,00:13:26.138,806138,00:13:27.856,807856,chunk356.wav,15271,And the judge writing issue here in seems to be a reoccurring theme.
356,00:13:29.575,809575,00:13:31.009,811009,chunk357.wav,14719,"Defendant wanting to make the case about the security of voting machines,"
357,00:13:32.444,812444,00:13:34.029,814029,chunk358.wav,11483,purported collusion between Dominion and government authorities and the like.
358,00:13:35.614,815614,00:13:36.782,816782,chunk359.wav,14426,This court has yet to see an evidentiary basis
359,00:13:37.950,817950,00:13:38.717,818717,chunk360.wav,12686,for the admission of this type of evidence.
360,00:13:39.485,819485,00:13:40.219,820219,chunk361.wav,12182,not to mention that Dominion has already sued
361,00:13:40.953,820953,00:13:42.454,822454,chunk362.wav,15053,both Fox News and other major election deniers for defamation over these
362,00:13:43.956,823956,00:13:45.858,825858,chunk363.wav,13682,"conspiracy theories, even getting a nearly $800 million settlement."
363,00:13:47.760,827760,00:13:48.777,828777,chunk364.wav,13430,"and after closing arguments wrapped up, the jury deliberated"
364,00:13:49.795,829795,00:13:51.697,831697,chunk365.wav,14633,"for nearly five hours and found Tina Peters guilty on seven criminal charges,"
365,00:13:53.699,833699,00:13:54.683,834683,chunk366.wav,15708,"that, including three counts of attempting to influence"
366,00:13:55.668,835668,00:13:57.403,837403,chunk367.wav,14215,"a public servant, one count of conspiracy to commit criminal impersonation,"
367,00:13:59.138,839138,00:14:00.572,840572,chunk368.wav,14204,First-Degree official misconduct and violation of duty.
368,00:14:02.007,842007,00:14:02.457,842457,chunk369.wav,13045,as far as what's next?
369,00:14:02.908,842908,00:14:03.942,843942,chunk370.wav,12692,"She's set to be sentenced at the beginning of October,"
370,00:14:04.977,844977,00:14:06.028,846028,chunk371.wav,13786,and she could be facing multiple years in prison.
371,00:14:07.079,847079,00:14:07.896,847896,chunk372.wav,14050,"with all of this, you know, kind of being history"
372,00:14:08.714,848714,00:14:09.848,849848,chunk373.wav,14097,because reportedly this conviction is the first time
373,00:14:10.983,850983,00:14:12.084,852084,chunk374.wav,13647,that prosecutors have managed to hold a local election
374,00:14:13.185,853185,00:14:14.853,854853,chunk375.wav,14079,official accountable for a security breach of a voting machine used in 2020.
375,00:14:16.522,856522,00:14:17.389,857389,chunk376.wav,15370,"and then in big international news,"
376,00:14:18.257,858257,00:14:18.507,858507,chunk377.wav,13514,we got to talk about
377,00:14:18.757,858757,00:14:20.392,860392,chunk378.wav,15488,how this Ukrainian offensive is now deep into Russian territory.
378,00:14:22.027,862027,00:14:22.894,862894,chunk379.wav,14106,"mean, we saw last Tuesday Ukrainian troops"
379,00:14:23.762,863762,00:14:25.280,865280,chunk380.wav,13619,just pouring into a Russian border region from several directions.
380,00:14:26.799,866799,00:14:28.250,868250,chunk381.wav,13302,that was actually super notable because until now is really only anti
381,00:14:29.702,869702,00:14:31.036,871036,chunk382.wav,13657,Kremlin Russian volunteers that had gone into Putin's territory.
382,00:14:32.371,872371,00:14:33.338,873338,chunk383.wav,15400,now I mean we're talking about battle tested
383,00:14:34.306,874306,00:14:35.540,875540,chunk384.wav,13905,Ukrainian forces making their way across the border.
384,00:14:36.775,876775,00:14:38.210,878210,chunk385.wav,14360,"with that, we've also now received official acknowledgment from Zelensky"
385,00:14:39.645,879645,00:14:41.463,881463,chunk386.wav,15403,"that the Ukrainian military is, in fact, operating inside Russian border areas."
386,00:14:43.315,883315,00:14:44.866,884866,chunk387.wav,15974,"in fact, there is evidence that up to 10,000 Ukrainian troops from at least"
387,00:14:46.418,886418,00:14:47.986,887986,chunk388.wav,13777,four brigades and possibly more are involved with Ukraine's top
388,00:14:49.555,889555,00:14:51.540,891540,chunk389.wav,14271,commander claiming they've taken control of 1000km² of Russian territory.
389,00:14:53.592,893592,00:14:54.743,894743,chunk390.wav,15640,is about as much land as Russia has taken so far this year.
390,00:14:55.895,895895,00:14:56.729,896729,chunk391.wav,13634,"And of course, that may be an overestimate."
391,00:14:57.563,897563,00:14:59.131,899131,chunk392.wav,13961,"either way, that is nothing compared to the 100,000km²"
392,00:15:00.699,900699,00:15:02.301,902301,chunk393.wav,14528,Russia's taken from Ukraine since the conflict started back in 2014.
393,00:15:03.903,903903,00:15:04.737,904737,chunk394.wav,13245,"again, this is still a massive deal."
394,00:15:05.571,905571,00:15:07.072,907072,chunk395.wav,13811,"mean, for more than a decade since Russia first invaded Ukraine and annexed"
395,00:15:08.574,908574,00:15:10.259,910259,chunk396.wav,12712,"Crimea, Putin's war has never directly affected the Russian people in this way."
396,00:15:11.944,911944,00:15:13.295,913295,chunk397.wav,12572,that started to change this year when Ukraine began using drones
397,00:15:14.647,914647,00:15:15.564,915564,chunk398.wav,13323,and missiles to strike deeper inside Russia.
398,00:15:16.482,916482,00:15:17.983,917983,chunk399.wav,14238,"it's become more and more of the case, especially since the US and allies gave"
399,00:15:19.485,919485,00:15:21.170,921170,chunk400.wav,13119,permission to carry out limited strikes inside Russia using the weapons supplied.
400,00:15:22.922,922922,00:15:23.989,923989,chunk401.wav,17018,"even with that said, thousands of boots on the ground,"
401,00:15:25.057,925057,00:15:25.574,925574,chunk402.wav,13025,that's a whole different story.
402,00:15:26.091,926091,00:15:26.274,926274,chunk403.wav,12689,"with that,"
403,00:15:26.458,926458,00:15:27.209,927209,chunk404.wav,13971,the Russian military has reportedly struggled
404,00:15:27.960,927960,00:15:29.294,929294,chunk405.wav,13827,"to deal with the attack, acting governor in the affected region, claiming"
405,00:15:30.629,930629,00:15:31.380,931380,chunk406.wav,12538,that Ukrainian forces had taken control
406,00:15:32.131,932131,00:15:33.699,933699,chunk407.wav,13917,"of 28 settlements, as well as saying that 12 civilians had been killed."
407,00:15:35.267,935267,00:15:36.084,936084,chunk408.wav,14059,government there also declaring a federal level
408,00:15:36.902,936902,00:15:37.669,937669,chunk409.wav,12237,"emergency in the affected area,"
409,00:15:38.437,938437,00:15:40.305,940305,chunk410.wav,15011,"about 121,000 people have left or been evacuated from combat areas"
410,00:15:42.174,942174,00:15:43.725,943725,chunk411.wav,14975,"with another 11,000 reportedly fleeing from a district in the neighboring region."
411,00:15:45.311,945311,00:15:46.662,946662,chunk412.wav,14076,"that said Russian reinforcements, including elite special forces"
412,00:15:48.013,948013,00:15:49.398,949398,chunk413.wav,12854,units and mercenaries are reportedly started to arrive in their place.
413,00:15:50.783,950783,00:15:50.949,950949,chunk414.wav,7847,"in fact,"
414,00:15:51.116,951116,00:15:52.000,952000,chunk415.wav,14092,what we're seeing is the Putin's actually being forced to pull
415,00:15:52.885,952885,00:15:54.153,954153,chunk416.wav,13040,some troops out of Ukraine and back into its own territory
416,00:15:55.421,955421,00:15:56.622,956622,chunk417.wav,14623,"to try to fend off this assault, is also likely"
417,00:15:57.823,957823,00:15:58.957,958957,chunk418.wav,12569,one of the objectives of this Ukrainian offensive.
418,00:16:00.092,960092,00:16:01.276,961276,chunk419.wav,13830,"there, I should also say it is one of many."
419,00:16:02.461,962461,00:16:04.296,964296,chunk420.wav,13859,One Ukrainian official telling AFP that the aim was to inflict maximum losses
420,00:16:06.131,966131,00:16:07.115,967115,chunk421.wav,12730,and to destabilize the situation in Russia.
421,00:16:08.100,968100,00:16:08.934,968934,chunk422.wav,14287,"at that point, you have people like one former U.S."
422,00:16:09.768,969768,00:16:10.719,970719,chunk423.wav,13480,ambassador to NATO telling the BBC.
423,00:16:11.670,971670,00:16:12.771,972771,chunk424.wav,14328,is not going to be lost on the elites in Russia.
424,00:16:13.872,973872,00:16:14.739,974739,chunk425.wav,14345,not going to be lost on the public.
425,00:16:15.607,975607,00:16:16.324,976324,chunk426.wav,14862,Putin has provoked attacks
426,00:16:17.042,977042,00:16:18.660,978660,chunk427.wav,13982,on the Russian territory itself and people are having to be evacuated.
427,00:16:20.279,980279,00:16:20.712,980712,chunk428.wav,15223,That's quite something.
428,00:16:21.146,981146,00:16:22.147,982147,chunk429.wav,13308,"then on top of that, there's a possibility that this brings back"
429,00:16:23.148,983148,00:16:24.766,984766,chunk430.wav,13578,international attention to the war and drums up renewed support for Ukraine.
430,00:16:26.418,986418,00:16:27.753,987753,chunk431.wav,14873,with that Republican Lindsey Graham was actually in Kyiv this week
431,00:16:29.088,989088,00:16:30.856,990856,chunk432.wav,15198,describing Ukraine's cross-border operation as bold and brilliant.
432,00:16:32.624,992624,00:16:33.308,993308,chunk433.wav,14529,"then on the other side of the aisle, you a Democrat?"
433,00:16:33.993,993993,00:16:35.627,995627,chunk434.wav,13440,"Richard Blumenthal, calling this historic and a seismic breakthrough."
434,00:16:37.262,997262,00:16:38.163,998163,chunk435.wav,14318,the two of them actually releasing a joint statement
435,00:16:39.064,999064,00:16:40.565,1000565,chunk436.wav,13240,this week saying they are more hopeful than ever that the tide of the war
436,00:16:42.067,1002067,00:16:42.968,1002968,chunk437.wav,12677,has turned against Putin. And his cronies.
437,00:16:43.869,1003869,00:16:45.787,1005787,chunk438.wav,14154,adding that bipartisan support for Ukraine is critical to American interests.
438,00:16:47.706,1007706,00:16:48.924,1008924,chunk439.wav,15672,"with that, on top of providing aid, there's speculation"
439,00:16:50.142,1010142,00:16:51.376,1011376,chunk440.wav,12655,"that the lack of an immediate, forceful response from Russia"
440,00:16:52.611,1012611,00:16:54.096,1014096,chunk441.wav,12642,could encourage allies to lift the limits in place on using Western
441,00:16:55.581,1015581,00:16:56.548,1016548,chunk442.wav,12561,supplied long range weapons inside Russia.
442,00:16:57.516,1017516,00:16:58.050,1018050,chunk443.wav,15298,"then also with this, Putin's"
443,00:16:58.584,1018584,00:16:59.568,1019568,chunk444.wav,13627,given his own reason for why he thinks Ukraine's
444,00:17:00.552,1020552,00:17:01.503,1021503,chunk445.wav,13814,"launched this attack, saying that it was actually aimed"
445,00:17:02.454,1022454,00:17:03.989,1023989,chunk446.wav,13192,at improving Kiev's negotiating position ahead of possible talks.
446,00:17:05.524,1025524,00:17:06.558,1026558,chunk447.wav,14933,then there finally you with Zelensky also saying it's
